Grupo;Situação;Ano Formação;Líder;Instituição;Unidade;Área predominante;UF;Repercussão;Linhas de Pesquisa;Instituições Parceiras;Indicadores de RH;link
ALODE - Grupo de Pesquisa em Algoritmos e Logística Descentralizada;Certificado;2020;Igor Machado Coelho;Universidade Federal Fluminense - UFF;;Ciências Exatas e da Terra, Ciência da Computação;RJ;O ALODE é uma continuação dos trabalhos do "Grupo de Pesquisa em Blockchain e Supply Chain", formado ainda quando o coordenador era professor/pesquisador da Universidade do Estado do Rio de Janeiro (UERJ). Devido a sua migração para a Universidade Federal Fluminense (UFF) em Janeiro/2020, as atividades do grupo tiveram de ser remanejadas, em nível organizacional, porém mantendo os vínculos profissionais e atividades já em andamento. O tema da Logística Descentralizada acabou ganhando força, bem como suas integrações recentes com a tecnologia Blockchain (que também se manifesta por outros nomes, como DLT), portanto optou-se por renomear o grupo durante essa transição, buscando um nome mais neutro tecnologicamente e, assim, mais duradouro. O repositório público também foi renomeado (para https://github.com/gp-alode), mantendo-se um redirecionamento automático para o conteúdo anterior existente.;{"Nome":Algoritmos de Consenso para Blockchain,"Q_Estudantes":1,"Q_Pesquisadores":2}|{"Nome":Ambientes de Experimentação para Blockchain e Contratos Inteligentes,"Q_Estudantes":0,"Q_Pesquisadores":5}|{"Nome":Aplicações inovadoras baseadas em blockchain,"Q_Estudantes":2,"Q_Pesquisadores":4}|{"Nome":Tomada de Decisão e Logística Descentralizada,"Q_Estudantes":3,"Q_Pesquisadores":3};;{"Formação acadêmica":Doutorado,"Pesquisadores":7,"Estudantes":5,"Técnicos":0,"Estrangeiros":0,"Total":12}|{"Formação acadêmica":Outros,"Pesquisadores":0,"Estudantes":1,"Técnicos":0,"Estrangeiros":0,"Total":1};http://dgp.cnpq.br/dgp/espelhogrupo/720493
Desenvolvimento de Sistemas Críticos;Certificado;2010;Adilson Luiz Bonifácio;Universidade Estadual de Londrina - UEL;Centro de Ciências Exatas;Ciências Exatas e da Terra, Ciência da Computação;PR;;{"Nome":Desenvolvimento de Sistemas Críticos,"Q_Estudantes":1,"Q_Pesquisadores":1}|{"Nome":Teste Baseado em Modelos,"Q_Estudantes":0,"Q_Pesquisadores":1}|{"Nome":Verificação de Contratos,"Q_Estudantes":1,"Q_Pesquisadores":1};{"Nome":Guenka Software,"Sigla":GUENKA,"UF":PR};{"Formação acadêmica":Doutorado,"Pesquisadores":1,"Estudantes":0,"Técnicos":0,"Estrangeiros":0,"Total":1}|{"Formação acadêmica":Graduação,"Pesquisadores":0,"Estudantes":1,"Técnicos":0,"Estrangeiros":0,"Total":1};http://dgp.cnpq.br/dgp/espelhogrupo/562104
Direito Administrativo Contemporâneo;Certificado;2013;Antonio Cecílio Moreira Pires;Universidade Presbiteriana Mackenzie - MACKENZIE;Faculdade de Direito;Ciências Sociais Aplicadas, Direito;SP;O Grupo tem por finalidade reexaminar os institutos do Direito Administrativo, contextualizados com o ordenamento constitucional atual quanto à estrutura, fundamentos e objetivos do Estado Brasileiro. O objetivo da pesquisa é demonstrar como o Direito Administrativo se concretiza como instrumento de cidadania em toda sua profundidade e extensão. Isso implica a necessária revisita ao próprio conceito de Direito Administrativo - princípios que o direcionam e os institutos que lhe são próprios - . As pesquisas estão voltadas ao estudo do papel do Estado e da sociedade civil. Temas: serviço público,saneamento básico, resíduo sólidos, transporte coletivo de passageiro, mobilidade, infraestrutura, sustentabilidade, políticas públicas, licitação, contratos públicos, concessão, cidades inteligentes, participação popular.;{"Nome":O Cidadão Modelando o Estado,"Q_Estudantes":3,"Q_Pesquisadores":9}|{"Nome":O Poder Econômico e seus Limites Jurídicos,"Q_Estudantes":2,"Q_Pesquisadores":2};;{"Formação acadêmica":Doutorado,"Pesquisadores":4,"Estudantes":0,"Técnicos":0,"Estrangeiros":0,"Total":4}|{"Formação acadêmica":Mestrado,"Pesquisadores":3,"Estudantes":0,"Técnicos":0,"Estrangeiros":0,"Total":3}|{"Formação acadêmica":Especialização,"Pesquisadores":1,"Estudantes":0,"Técnicos":0,"Estrangeiros":0,"Total":1}|{"Formação acadêmica":Graduação,"Pesquisadores":1,"Estudantes":3,"Técnicos":0,"Estrangeiros":0,"Total":4}|{"Formação acadêmica":Outros,"Pesquisadores":0,"Estudantes":1,"Técnicos":0,"Estrangeiros":0,"Total":1};http://dgp.cnpq.br/dgp/espelhogrupo/1135
Direito do Consumidor e Sociedade da Era Digital;Certificado - Não-atualizado há mais de 12 meses;2019;Adriano Fernandes Moreira ;Fundação UNIRG - UNIRG;;Ciências Sociais Aplicadas, Direito;TO;A velocidade das transformações nos negócios jurídicos realizados na sociedade da era digital exige reflexões críticas acerca das tendências pós-modernas e indústria 4. O surgimento da blockchain, por exemplo, leva os juristas a acreditarem no surgimento de novos Direitos Fundamentais. O sistema legal, como não poderia deixar de ser, deve se modificar para acompanhar esta nova realidade, de uma nova era altamente tecnológica e digital. O grupo de estudos em Direito do Consumidor e Sociedade da Era Digital foi criado para acompanhar estas mudanças sociais e para responder com celeridade e de forma mais efetiva aos reais anseios dos consumidores, cada dia mais surpreendidos com as inovações tecnológicas. Os novos contratos inteligentes, o surgimento da nova Lex Criptographia, as práticas comerciais disruptivas e representativas de novos paradigmas, os negócios virtuais e suas implicações jurídicas, suscitam uma abordagem Zetética.;{"Nome":Inteligência Artificial,"Q_Estudantes":0,"Q_Pesquisadores":1}|{"Nome":Criptomoedas, Lex Criptographia e smart contracts.,"Q_Estudantes":2,"Q_Pesquisadores":1}|{"Nome":O acesso à justiça pelos consumidores na era digital.,"Q_Estudantes":0,"Q_Pesquisadores":1}|{"Nome":Tutela dos interesses e direitos difusos, coletivos e individuais homogêneos consumeristas,"Q_Estudantes":0,"Q_Pesquisadores":1};;{"Formação acadêmica":Doutorado,"Pesquisadores":1,"Estudantes":0,"Técnicos":0,"Estrangeiros":0,"Total":1}|{"Formação acadêmica":Especialização,"Pesquisadores":0,"Estudantes":0,"Técnicos":1,"Estrangeiros":0,"Total":1}|{"Formação acadêmica":Graduação,"Pesquisadores":0,"Estudantes":2,"Técnicos":0,"Estrangeiros":0,"Total":2};http://dgp.cnpq.br/dgp/espelhogrupo/483457
Direito, Tecnologia e Inovação;Certificado - Não-atualizado há mais de 12 meses;2016;Técio Spínola Gomes ;Universidade Federal da Bahia - UFBA;Faculdade de Direito;Ciências Sociais Aplicadas, Direito;BA;O grupo analisa os reflexos das novas tecnologia na área jurídica e como o Direito pode auxiliar no apoio à inovação. Divulga as pesquisas por meio de seminários, podcast, vídeos em plataforma online e artigos acadêmicos.;{"Nome":Blockchain e direito contratual,"Q_Estudantes":0,"Q_Pesquisadores":1}|{"Nome":O papel do Direito Empresarial nas políticas de ciência, tecnologia e inovação,"Q_Estudantes":0,"Q_Pesquisadores":2};;{"Formação acadêmica":Doutorado,"Pesquisadores":2,"Estudantes":0,"Técnicos":0,"Estrangeiros":0,"Total":2}|{"Formação acadêmica":Mestrado Profissional,"Pesquisadores":1,"Estudantes":0,"Técnicos":0,"Estrangeiros":0,"Total":1};http://dgp.cnpq.br/dgp/espelhogrupo/773540
INSERT;Certificado;2014;Allan Edgard Silva Freitas;Instituto Federal da Bahia - IFBA;IFBA - Campus Salvador;Ciências Exatas e da Terra, Ciência da Computação;BA;;{"Nome":Blockchain,"Q_Estudantes":3,"Q_Pesquisadores":1}|{"Nome":Gerência de Redes,"Q_Estudantes":1,"Q_Pesquisadores":3}|{"Nome":Internet do Futuro,"Q_Estudantes":11,"Q_Pesquisadores":3};;{"Formação acadêmica":Doutorado,"Pesquisadores":4,"Estudantes":4,"Técnicos":0,"Estrangeiros":0,"Total":8}|{"Formação acadêmica":Mestrado,"Pesquisadores":0,"Estudantes":1,"Técnicos":0,"Estrangeiros":0,"Total":1}|{"Formação acadêmica":Mestrado Profissional,"Pesquisadores":0,"Estudantes":1,"Técnicos":0,"Estrangeiros":0,"Total":1}|{"Formação acadêmica":Graduação,"Pesquisadores":0,"Estudantes":5,"Técnicos":0,"Estrangeiros":0,"Total":5}|{"Formação acadêmica":Outros,"Pesquisadores":0,"Estudantes":4,"Técnicos":0,"Estrangeiros":0,"Total":4};http://dgp.cnpq.br/dgp/espelhogrupo/3083335562160256
