Grupo;Situação;Ano Formação;Líder;Instituição;Unidade;Área predominante;UF;Repercussão;Linhas de Pesquisa;Instituições Parceiras;Indicadores de RH;link
Grupo de Empreendedorismo, Decisão, Análise e Inovação na Amazônia;Certificado;2020;Thiago Poleto;Universidade Federal do Pará - UFPA;;Ciências Sociais Aplicadas, Administração;AL;;{"Nome":Application of Geographical Information System in Urban Design,"Q_Estudantes":0,"Q_Pesquisadores":1}|{"Nome":Aprendizado automático (machine learning) para robótica, automação de processos e tomada de decisão,"Q_Estudantes":0,"Q_Pesquisadores":2}|{"Nome":Efficiency and Productivity Analysis,"Q_Estudantes":0,"Q_Pesquisadores":1}|{"Nome":Estratégia, Inovação e Desempenho Organizacional,"Q_Estudantes":9,"Q_Pesquisadores":2};;{"Formação acadêmica":Doutorado,"Pesquisadores":3,"Estudantes":0,"Técnicos":0,"Estrangeiros":0,"Total":3}|{"Formação acadêmica":Mestrado,"Pesquisadores":1,"Estudantes":4,"Técnicos":0,"Estrangeiros":0,"Total":5}|{"Formação acadêmica":Mestrado Profissional,"Pesquisadores":1,"Estudantes":0,"Técnicos":1,"Estrangeiros":0,"Total":2}|{"Formação acadêmica":Graduação,"Pesquisadores":0,"Estudantes":3,"Técnicos":0,"Estrangeiros":0,"Total":3}|{"Formação acadêmica":Outros,"Pesquisadores":0,"Estudantes":2,"Técnicos":0,"Estrangeiros":0,"Total":2};http://dgp.cnpq.br/dgp/espelhogrupo/9087603023311119
Indústria 4.0;Certificado;2020;Bruno Nazário Coelho;Universidade Federal de Ouro Preto - UFOP;Escola de Minas;Engenharias, Engenharia Elétrica;MG;Este grupo multidisciplinar desenvolve pesquisas relacionadas às tecnologias consideradas como pilares para a Indústria 4.0. O principal objetivo é o intercâmbio de conhecimentos de modo a proporcionar o desenvolvimento de novas tecnologias para melhoria de processos produtivos em busca de uma melhor qualidade de vida para as pessoas. Os principais resultados esperados são as aplicações práticas das tecnologias e processos desenvolvidos, além do incentivo para a popularização da ciência e tecnologia.;{"Nome":Blockchain, Cibersegurança, Criptografia e Cloud Computing,"Q_Estudantes":0,"Q_Pesquisadores":2}|{"Nome":Compliance e Governança Corporativa,"Q_Estudantes":0,"Q_Pesquisadores":1}|{"Nome":Digital Twin, Realidade Aumentada e Realidade Virtual,"Q_Estudantes":4,"Q_Pesquisadores":1}|{"Nome":IIoT (Industrial Internet of Things),"Q_Estudantes":2,"Q_Pesquisadores":1}|{"Nome":Indústria 4.0,"Q_Estudantes":1,"Q_Pesquisadores":6}|{"Nome":Inteligência Artificial, Data Science, Big Data e Analytics,"Q_Estudantes":3,"Q_Pesquisadores":1}|{"Nome":Manufatura Aditiva,"Q_Estudantes":0,"Q_Pesquisadores":2}|{"Nome":Otimização e Algoritmos Avançados,"Q_Estudantes":1,"Q_Pesquisadores":4}|{"Nome":Robótica,"Q_Estudantes":3,"Q_Pesquisadores":1}|{"Nome":Simulação,"Q_Estudantes":0,"Q_Pesquisadores":1};{"Nome":Fundação de Amparo à Pesquisa do Estado de Minas Gerais,"Sigla":FAPEMIG,"UF":MG}|{"Nome":Conselho Nacional de Desenvolvimento Científico e Tecnológico,"Sigla":CNPq,"UF":DF}|{"Nome":Instituto Tecnológico Vale,"Sigla":ITV,"UF":RJ};{"Formação acadêmica":Doutorado,"Pesquisadores":8,"Estudantes":0,"Técnicos":0,"Estrangeiros":0,"Total":8}|{"Formação acadêmica":Mestrado,"Pesquisadores":0,"Estudantes":0,"Técnicos":2,"Estrangeiros":0,"Total":2}|{"Formação acadêmica":Mestrado Profissional,"Pesquisadores":0,"Estudantes":4,"Técnicos":0,"Estrangeiros":0,"Total":4}|{"Formação acadêmica":Especialização,"Pesquisadores":1,"Estudantes":0,"Técnicos":0,"Estrangeiros":0,"Total":1}|{"Formação acadêmica":Graduação,"Pesquisadores":0,"Estudantes":3,"Técnicos":0,"Estrangeiros":0,"Total":3}|{"Formação acadêmica":Outros,"Pesquisadores":0,"Estudantes":7,"Técnicos":0,"Estrangeiros":0,"Total":7};http://dgp.cnpq.br/dgp/espelhogrupo/689673
Núcleo de Pesquisa em Engenharia do Conhecimento;Certificado;1999;Regina Maria Maciel Braga;Universidade Federal de Juiz de Fora - UFJF;Instituto de Ciências Exatas;Ciências Exatas e da Terra, Ciência da Computação;MG;O NPQS nasceu de parcerias interinstitucionais em 1997. Os trabalhos se iniciaram com qualidade de software educacional em parceria com a COPPE/UFRJ. As pesquisas se expandiram para a qualidade de software agropecuário em parceria com o Núcleo Softex Agrosoft, Embrapa-CNPTIA, Embrapa-CNPGL, UFV e UFLA. Depois as pesquisas focaram o Desenvolvimento Baseado em Componentes. Com a criação do mestrado em Modelagem Computacional em 2006, parceria do Departamento de Ciência da Computação com a Faculdade de Engenharia, o grupo focou suas pesquisas em e-Science. Com a expansão do Departamento de Ciência da Computação e criação do Programa de Pós Graduação em Ciência da Computação em 2011 o grupo de expandiu e atua nas seguintes áreas: ecossistemas de software, ontologias, serviços web semânticos, e-science, trabalho cooperativo, redes complexas, manutenção e evolução de software e testes.;{"Nome":Agentes de software,"Q_Estudantes":0,"Q_Pesquisadores":2}|{"Nome":Arquitetura orientada a serviços,"Q_Estudantes":0,"Q_Pesquisadores":2}|{"Nome":Cloud Computing,"Q_Estudantes":0,"Q_Pesquisadores":2}|{"Nome":Desenvolvimento Distribuído de Software,"Q_Estudantes":1,"Q_Pesquisadores":1}|{"Nome":e--Science,"Q_Estudantes":1,"Q_Pesquisadores":4}|{"Nome":ecosistemas de software,"Q_Estudantes":0,"Q_Pesquisadores":6}|{"Nome":Gerência de Configuração de Software,"Q_Estudantes":0,"Q_Pesquisadores":1}|{"Nome":Governança de TI,"Q_Estudantes":0,"Q_Pesquisadores":1}|{"Nome":Informática na Educação,"Q_Estudantes":0,"Q_Pesquisadores":4}|{"Nome":Interoperabilidade,"Q_Estudantes":0,"Q_Pesquisadores":1}|{"Nome":Linha de Produtos de Software,"Q_Estudantes":0,"Q_Pesquisadores":4}|{"Nome":Manutenção e Evolução de Software,"Q_Estudantes":0,"Q_Pesquisadores":2}|{"Nome":Mineração de Dados,"Q_Estudantes":2,"Q_Pesquisadores":1}|{"Nome":Ontologias,"Q_Estudantes":0,"Q_Pesquisadores":6}|{"Nome":Processo de Software,"Q_Estudantes":0,"Q_Pesquisadores":4}|{"Nome":Proveniência de Dados,"Q_Estudantes":0,"Q_Pesquisadores":3}|{"Nome":Qualidade de Software,"Q_Estudantes":0,"Q_Pesquisadores":3}|{"Nome":Redes Complexas,"Q_Estudantes":0,"Q_Pesquisadores":2}|{"Nome":self-adaptive systems,"Q_Estudantes":0,"Q_Pesquisadores":2}|{"Nome":Sistemas colaborativos,"Q_Estudantes":0,"Q_Pesquisadores":2}|{"Nome":Teste de Software,"Q_Estudantes":0,"Q_Pesquisadores":1}|{"Nome":Visualização de Software,"Q_Estudantes":1,"Q_Pesquisadores":5}|{"Nome":Web semântica,"Q_Estudantes":2,"Q_Pesquisadores":5}|{"Nome":Workflow científico,"Q_Estudantes":2,"Q_Pesquisadores":3};{"Nome":Laboratório Nacional de Computação Científica,"Sigla":LNCC,"UF":RJ}|{"Nome":Departamento de Ciências da Computação,"Sigla":UFBA,"UF":BA}|{"Nome":Centro de Tecnologia e Ciências,"Sigla":UERJ/CTC,"UF":RJ}|{"Nome":Reitoria,"Sigla":UFRJ,"UF":RJ}|{"Nome":Reitoria,"Sigla":UNIFACS,"UF":BA}|{"Nome":Reitoria,"Sigla":UNIRIO,"UF":RJ}|{"Nome":IF do Sudeste de Minas Gerais - Campus Juiz de Fora,"Sigla":IF SUDESTE MG,"UF":MG};{"Formação acadêmica":Doutorado,"Pesquisadores":13,"Estudantes":0,"Técnicos":1,"Estrangeiros":1,"Total":15}|{"Formação acadêmica":Mestrado,"Pesquisadores":1,"Estudantes":0,"Técnicos":0,"Estrangeiros":0,"Total":1}|{"Formação acadêmica":Outros,"Pesquisadores":0,"Estudantes":4,"Técnicos":0,"Estrangeiros":0,"Total":4};http://dgp.cnpq.br/dgp/espelhogrupo/36075
Transformação nas Organizações, Sociedade e indivíduos - TOSI;Certificado - Não-atualizado há mais de 12 meses;2021;Kumiko Oshio Kissimoto ;Universidade Federal de São Paulo - UNIFESP;Campus Osasco;Ciências Sociais Aplicadas, Administração;SP;Nas últimas décadas, organizações, sociedade e indivíduos têm sentido os impactos das grandes transformações que vêm ocorrendo devido aos avanços tecnológicos. A combinação entre sistemas computacionais, comunicação, tecnologias de conectividade, aplicações em nuvem, IoT e big data entre outras tecnologias digitais abre novos espaços colaborativos e possibilidades de modelos de negócios. Porém, é grande também os desafios enfrentados pelas organizações que tentam se adaptar ou repensar em seus modelos de negócios e estratégias. Alinhado à este desafio organizacional está o desafio de entender como os indivíduos são impactados pelas diferentes tecnologias digitais. Seus hábitos de compra e a forma como se organizam em sociedade têm impactos sobre como as organizações mudam suas estratégias para atender à estas novas demandas. Este grupo de pesquisa dedica-se a pesquisar como a transformação digital tem afetado organizações, sociedade e indivíduos.;{"Nome":Ecossistemas, plataformas digitais e economia circular - estratégias para um crescimento colaborativo e sustentável,"Q_Estudantes":1,"Q_Pesquisadores":3}|{"Nome":Mudanças comportamentais devido à adoção de novas tecnologias e seus impactos nas organizações,"Q_Estudantes":1,"Q_Pesquisadores":3}|{"Nome":Novos modelos e estratégias de negócios na transformação digital,"Q_Estudantes":1,"Q_Pesquisadores":5}|{"Nome":O impacto da transformação digital na operação das organizações,"Q_Estudantes":2,"Q_Pesquisadores":3}|{"Nome":O papel da capacidade analítica na transformação das organizações,"Q_Estudantes":0,"Q_Pesquisadores":2};;{"Formação acadêmica":Doutorado,"Pesquisadores":7,"Estudantes":0,"Técnicos":0,"Estrangeiros":0,"Total":7}|{"Formação acadêmica":Mestrado,"Pesquisadores":0,"Estudantes":1,"Técnicos":0,"Estrangeiros":0,"Total":1}|{"Formação acadêmica":Graduação,"Pesquisadores":0,"Estudantes":2,"Técnicos":0,"Estrangeiros":0,"Total":2}|{"Formação acadêmica":Outros,"Pesquisadores":0,"Estudantes":1,"Técnicos":0,"Estrangeiros":0,"Total":1};http://dgp.cnpq.br/dgp/espelhogrupo/724413
Transformação Digital de Processos Industriais;Certificado;2021;Heleno Bispo da Silva Junior;Universidade Federal de Campina Grande - UFCG;Departamento de Engenharia Química;Engenharias, Engenharia Química;PB;;{"Nome":Desenvolvimento e simulação de sistemas e processos informatizados,"Q_Estudantes":6,"Q_Pesquisadores":13}|{"Nome":Engenharia de Sistemas de Processos com Foco à Indústria 4.0,"Q_Estudantes":4,"Q_Pesquisadores":13}|{"Nome":Sustentabilidade Aplicada a Indústria,"Q_Estudantes":0,"Q_Pesquisadores":2};;{"Formação acadêmica":Doutorado,"Pesquisadores":13,"Estudantes":3,"Técnicos":0,"Estrangeiros":0,"Total":16}|{"Formação acadêmica":Mestrado Profissional,"Pesquisadores":1,"Estudantes":0,"Técnicos":0,"Estrangeiros":0,"Total":1}|{"Formação acadêmica":Graduação,"Pesquisadores":0,"Estudantes":8,"Técnicos":0,"Estrangeiros":0,"Total":8};http://dgp.cnpq.br/dgp/espelhogrupo/693613
XRAI - Realidade Estendida e Inteligência Artificial;Certificado;2021;Sérgio Augusto Bitencourt Petrovcic;Instituto Federal de Santa Catarina - IFSC;Instituto Federal de Santa Catarina - Câmpus Itajaí;Engenharias, Engenharia Elétrica;SC;;{"Nome":Visão Computacional,"Q_Estudantes":0,"Q_Pesquisadores":2}|{"Nome":Ambiente Virtual de Aprendizagem e Gamificação,"Q_Estudantes":0,"Q_Pesquisadores":1}|{"Nome":Análise e Desenvolvimento de Software,"Q_Estudantes":0,"Q_Pesquisadores":2}|{"Nome":Automação e internet das coisas (IoT),"Q_Estudantes":0,"Q_Pesquisadores":4}|{"Nome":Digital Twin, Realidade Aumentada e Realidade Virtual,"Q_Estudantes":0,"Q_Pesquisadores":3}|{"Nome":Inteligência artificial,"Q_Estudantes":0,"Q_Pesquisadores":2}|{"Nome":Modelagem e Impressão 3D,"Q_Estudantes":1,"Q_Pesquisadores":3}|{"Nome":Navegação indoor baseada em realidade aumentada,"Q_Estudantes":0,"Q_Pesquisadores":1}|{"Nome":Simuladores virtuais 3D,"Q_Estudantes":3,"Q_Pesquisadores":1}|{"Nome":Soluções para a construção civil baseadas em realidade aumentada,"Q_Estudantes":0,"Q_Pesquisadores":1};;{"Formação acadêmica":Doutorado,"Pesquisadores":3,"Estudantes":0,"Técnicos":0,"Estrangeiros":0,"Total":3}|{"Formação acadêmica":Mestrado,"Pesquisadores":4,"Estudantes":0,"Técnicos":0,"Estrangeiros":0,"Total":4}|{"Formação acadêmica":Especialização,"Pesquisadores":0,"Estudantes":0,"Técnicos":1,"Estrangeiros":0,"Total":1}|{"Formação acadêmica":Graduação,"Pesquisadores":0,"Estudantes":4,"Técnicos":0,"Estrangeiros":0,"Total":4};http://dgp.cnpq.br/dgp/espelhogrupo/774908
